{
  "schema_version": "apex-labs.finding/v1",
  "finding_id": "synthetic-mechanics-demo",
  "version": "1.0.0",
  "title": "Synthetic pipeline mechanics demonstration",
  "research_question": "Can Apex Labs deterministically ingest, normalize, fingerprint, validate, and export a tiny declared dataset?",
  "status": "inconclusive",
  "scope": "session_specific",
  "evidence_classification": "synthetic_demo",
  "hypothesis": "The Milestone 0 mechanics can process a declared synthetic tabular dataset without treating it as scientific evidence.",
  "conclusion": "The artifact records a software-path demonstration only. It contains no evidence about a driver, car, track, simulator, technique, causal effect, or population.",
  "analyst_claim": {
    "proposed_status": "inconclusive",
    "rationale": "The synthetic run is a software mechanics check and cannot support a scientific disposition."
  },
  "validation_artifact_reference": {
    "validation_id": "synthetic-mechanics-demo-validation",
    "version": "1.0.0"
  },
  "scientific_review_state": "unresolved",
  "product_review_state": "not_requested",
  "effect_estimate": null,
  "uncertainty": {
    "method": "not_applicable_synthetic_mechanics_demo",
    "interval": null,
    "confidence_level": null,
    "interpretation": "No inferential estimate or confidence statement was produced."
  },
  "sample_counts": {
    "drivers": 0,
    "cars": 0,
    "tracks": 0,
    "sessions": 1,
    "laps": 2,
    "corners_or_events": 0,
    "observations": 8
  },
  "sample_sufficiency": {
    "status": "insufficient",
    "method": "not_applicable_synthetic_mechanics_demo",
    "rationale": "Synthetic samples cannot satisfy a scientific sample requirement."
  },
  "comparability_assessment": {
    "status": "undetermined",
    "criteria_applied": [
      "Schema validity and record linkage only"
    ],
    "violations": [
      "No real conditions or performance events exist to compare"
    ]
  },
  "dataset_references": [
    {
      "dataset_id": "synthetic-mechanics-demo",
      "fingerprint": "533a660c2d8d8e496d8fc5f1081a03affbc40e1d92ef80d0e7689f44038360de",
      "normalized_manifest_sha256": "57213467d6a69ae5184a274457b39f17f18d359f82b85cf7aefae6994909b26f",
      "records_sha256": "de125c35b2f1b62b31b82cd4044fc438a4289135d005fc8aea9c6a9a19a39832",
      "synthetic": true
    }
  ],
  "protocol_reference": {
    "experiment_id": "synthetic-mechanics-demo-protocol",
    "version": "1.0.0",
    "freeze_id": "synthetic-mechanics-demo-protocol.freeze",
    "freeze_sha256": "34fc34030e5518dd4d9530cfd05a530f9a4718002c5cc2b8cfadae286ccef175"
  },
  "preprocessing": {
    "pipeline_id": "tabular-csv-normalization",
    "pipeline_version": "1.1.0",
    "normalization_version": "1.1.0",
    "configuration": {
      "normalized_dataset_fingerprint": "533a660c2d8d8e496d8fc5f1081a03affbc40e1d92ef80d0e7689f44038360de",
      "normalized_manifest_sha256": "57213467d6a69ae5184a274457b39f17f18d359f82b85cf7aefae6994909b26f"
    },
    "configuration_sha256": "49932bc82e4e952ca9922cb9b922cdbe06228d83002d2eaba2374e2293420f66"
  },
  "analysis": {
    "algorithm_id": "demo-record-count",
    "algorithm_version": "1.0.0",
    "configuration": {
      "purpose": "mechanics_only"
    },
    "random_seed": null
  },
  "analysis_code_identity": {
    "package_version": "0.1.1",
    "git_commit": "5b873bd18889c8438e3c6d461c1e846db96b0629",
    "git_state": "clean",
    "code_and_schema_sha256": "daf04af72a4d4008f691a03a926a43ba232732bdbd5f75eb19430c157eb0e44b"
  },
  "limitations": [
    "All values were hand-authored and synthetic.",
    "The record counts prove mechanics, not research validity.",
    "No experiment was executed and no performance hypothesis was tested."
  ],
  "possible_confounders": [
    "Not applicable because this is not a scientific result."
  ],
  "generalizability_assessment": "None. This artifact must not be generalized to any driver, vehicle, track, simulator, corner, algorithm, or population.",
  "falsification_attempts": [
    "No racing hypothesis exists to falsify; integrity checks exercised malformed input, hashes, schema constraints, and export verification."
  ],
  "product_implication": "The export format can be inspected by a future production reviewer; it offers no coaching recommendation.",
  "recommended_product_action": "do_not_implement",
  "safe_for_global_consideration": false,
  "required_future_validation": [
    "Collect real data under an approved, preregistered protocol before evaluating any performance claim.",
    "Replace UNCOMMITTED with an Apex Labs source commit for every real finding."
  ],
  "created_at": "2026-08-19T00:00:00Z",
  "apex_labs_source_commit": "5b873bd18889c8438e3c6d461c1e846db96b0629",
  "synthetic": true
}
